Review,Date,Stars
"Non descriptive technical issues receiving money. Support says everything is fine even as I get a ""technical issues"" error note.",2024-10-17,2
States it no longer compatible with my device. Nice,2024-10-17,2
"The new app interface is aweful. I liked it quite a bit before, but now it is tricky to tell what you've paid for the current statement amd what is owed for current billing cycle. FAR LESS intuitive than it was prior to most recent update. Please fix this, and stop making it a requirement to update the app just to use it. Had I not needed to update it, I'd have remained a happy customer, rather than having become disgruntled with trying to navigate this confusing and counterintuitive interface.",2024-10-17,2
For last couple months when I open and click on payment or try to look at any beyond credit card balances it just spins forever and I give up. Disappointing....,2024-10-17,2
"As of late, I have been having a ton of problems with the app. Started happening when I switched from Apple to Samsung.",2024-10-16,2
was good while it worked. it no longer supports my phone.,2024-10-16,2
Definitely not a bank 🏧😞 for myself because I don't live near a Citi Bank 🏦🏧. But if you live closer then it's ok bank!,2024-10-16,2
Unable to Fingerprint scan for login. App does not respond after pressing on the fingerprint icon on authentication screen.,2024-10-15,2
Continues to crash; loads a bit and then the loading icon starts to twirl and it never stops,2024-10-15,2
Forcing updates? again. and again. and again. what a pain..,2024-10-14,2
"It's so slow, things don't load. I'm better off going to the website.",2024-10-14,2
"Very poor user interface. All I want to see is my credit card charges and it takes several different pages. There are too many options on the front page, other companies do a better job",2024-10-14,2
Downloaded this app can't even get it to work what's going on,2024-10-11,2
Too many chamges. I prefer a paper statement,2024-10-11,2
I been a citi banker since 2000. I personally like the interface of this app compared to other banking apps. But the biggest turn off is how it can't read less than stellar handwriting in checks. But the same checks can be deposited successfully with ease on other banking app.,2024-10-11,2
I have my password saved and the app says it does not recognize it. I am not able to access any info.,2025-05-24,3
App still won't load statements and now I can't even make a payment.,2025-05-23,3
I'm really not impressed at all by citibank from the moment I got approved for the credit card I had issues with suspicious activity before the card was even activated. Now a few years later for no reason my account has been like reset and I have to re link my personal loan account and re add my payment method as well as re register my card. I would not recommend citibank.,2025-05-23,3
Before y'all decide to do business with these ripoffs go read the reviews and also check how many law suits they have against them. BAD HORRIBLE and definitely DISHONEST,2025-05-22,3
"The app needs some serious work everytime you log into it bugs out and won't load anything making it a real pain to do anything with your account, it will make you not want to bank with them that's how bad this app is.",2025-05-22,3
not good!,2025-05-22,3
By far the clunkiest and buggiest major credit card app. It times out constantly and has consistent periods where nothing will load.,2025-05-22,3
"Might as well drive down to the bank this app sucks. Can never check my statement. The app consistently has trouble loading, if it loads at all.",2025-05-21,3
"Fix biometrics. Yes I tried reinstalling/updating, no the issue keeps coming back.",2025-05-21,3
cannot use,2025-05-21,3
ripp off!!,2025-05-21,3
"nothing ever loads, loading screen for every option and it never gets past loading screen. random logout while in the middle of looking at information on the app and upon logging in it gets stuck on loading screen having user force close just to try again and hope it works correct",2025-05-20,3
Absolute worst company out there. Over a year and they still cannot fix their online payments!!! Now they Are refusing to take a payment over the phone. I suggest any other company besides this one. Complete nightmare to deal with,2025-05-20,3
l hate updates. I'm in a hurry and l have to go through this,2025-05-19,3
"Update. Impossible to use this ""fng"" app. Garbage. App is tricky on sign in but overall very easy to use.",2025-05-19,3
can't use on my android phone,2025-05-19,3
Will not login! Just keeps loading!,2025-05-19,3
"The app broke and caused me to miss a payment. When I select the option to pay, it just shows the loading icon forever. When I try to contact support with the app, it does the same thing. It's been over a week and it still doesn't work. I was eventually able to pay using the mobile website, but it was acting strange as well (it let me log in with just my password and no user ID).",2025-05-19,3
"the fact that I need 2 different sets of credentials to use my personal and business accounts, and I can't link them somehow like every other credit card is very inconvenient.",2025-05-18,3
SUCKS!!!,2025-05-18,3
crashes everytime I put in my password,2025-05-18,3
"Less than useless. Will not accept any current password at any point, regardless of whether last reset via web, app, or phone.",2025-05-18,3
"this is the worst bank you can deposit your money in, I don't recommend it to anyone.",2025-05-18,3
"Citi doesn't credit me with merchant offers.. MISLEADING. CUSTOMER SERVICE AND DISPUTES ARE HORRIBLE. IF YOU DO GET SOMEONE ON THE PHONE WITH SOMETHING YOU CAN'T RESOLVE ON THE WEBSITE, YOU END UP TALKING TO SOMEBODY INCOMPETENT IN INDIA",2025-05-18,3
the app never let's you log in to pay can see account can see what's on card and what's due but app crashes everything and never let's you enter pen to pay your bill,2025-05-18,3
"my purse was stolen in February. I called the credit bureau and had all my accounts frozen. I could not and Did NOT make any purchases in over 3 months. I asked for a new card with a new # and got a card with fraudulent charges on it. Reported the fraud the 1st week of May. Asked for a new card. Was told a new card would be sent, still nothing. Now more charges!!!?",2025-05-17,3
"Still unusable, the worst customer service on the planet. Wants me to email them. How about this, why don't you just fix the app? Duh!",2025-05-17,3
"my rating is for the customer service not the app, because there is no obvious way to provide feedback for their service. because the reps are not held accountable, I assume this behavior just carries on. I called to ask questions about a flex plan. The rep couldn't answer my questions and after putting me on hold several times for several minutes, she pretended she couldn't hear me and screamed over and over ""because I lost our connection I will end this call now"". My connection was perfect",2025-05-17,3
"I go to make a payment and it just gets to an endless loading screen. Terrible, terrible app. And considering this affects the ability to actually make a payment and could induce late fees or interest fees, I sense this could become an actual legal issue.",2025-05-17,3
terrible large bank with outdated policies and foreign customer service,2025-05-17,3
"Do NOT do business with these people. I've got 20 years as a loyal customer, no missed payments no issues whatsoever and tens of thousands of dollars in transactions. I have $90 worth of fraud hit my account and immediately report. They side with the scammers and say I have to pay the charges. F U Citi... card destroyed, will never do business again!!",2025-05-16,3
when you click on make a payment the app hangs and you have to close amd restart it,2025-05-16,3
"My experience with your customer service representative today was very frustrating as I experienced extreme difficulty in understanding her... I believe she is sending me a copy of my April statement which I not yet received... I received my May statement today... and still have issues with recurring charges, which are fraudulent and unresolved by Citi... I will be in contact with your fraud department again once I receive my April statement..",2025-05-15,3
"Unable to sign in. No matter how many times I attempt to change User ID or password, it always fails. Good thing I have email reminders and can get in that way or I'd be sunk!",2025-05-15,3
"past 3 months, I have not been able to make my payment on the app. it takes 20 minutes to load! Awful! Awful! Awful!",2025-05-15,3
barely loads and do what I want,2025-05-15,3
"sooo, Citi abandoned age old customers sign ins - in favor of some new mangers' fantasies of becoming famous for ""inovation""?",2025-05-15,3
The app freezes when loading or refreshing a new page.,2025-05-15,3
If you have any issues their customer service will juggle you like a clown. They dont care about loyal customers and they have the highest APR out of all my cards and have always refused to come down even if you plead with them. Theyll only help you if you stop paying so apperantly thats in your best interest if you need help from them and want them to notice.,2025-05-15,3
"it was good until they closed my account for 1 bounced payment, no warnings no retry, just closed it.",2025-05-14,3
terrible,2025-05-14,3
"If the app is anything like trying to contact a live person at city, it would be dead gum impossible to use this app.You cannot contact and get an answer from anyone at this organizationq",2025-05-14,3
Never works since update. biometrics doesn't work and crashes my phone,2025-05-14,3
"Paid off the balance. Then, they lowered the available credit by 6000 dollars. Why? Bad faith business. Do not use. They called me to say they sent me a letter. Who cares? How does that help? Refused to help. Do not pay off a Citibank card. edit: they set up a phone appointment. on the phone call, all they would say is that they sent me a letter. waste of time.",2025-05-14,3
"I don't want to chat with AI. No understanding of my questions. When asked for live agent, no better help. Typing to respond, I get pop up I'm taking long with no interaction. There's no consideration for seniors or those who don't use technology much. Everyone is trying to force technology on people with no consideration. Everything is becoming dehumanized. Companies only care about money and not customer service or helping anymore. I'm trying to pay off all my credit cards and not have any.",2025-05-13,3
why do you need my cking account and password?,2025-05-13,3
"Updating my review because this app has two jobs and it can't consistently do either of them. I can usually check my balance without much hassle, but forget making payments—the primary reason I have this app.",2025-05-13,3
"The latest version of the citi mobile is a bit exhausting, i get locked out all the time, i tried opening a bank account it says access blocked I tried redeeming my reward says access blocked as well the latest app version should reviwed.",2025-05-12,3
very poor service for every main feature I try to use it says access blocked please this should be reviewed,2025-05-12,3
Unusable,2025-05-12,3
no human,2025-05-12,3
"WARNING !!! : I thought I would start a Citibank account to see how they would be. I deposited my first deposit, they somehow flagged the deposit as a scam and shut down the whole account with no explanation also voiding the check I deposited. The whole thing was a disaster from start to finish. do yourself a favor and stay with Capital One. edit: They shut my account then put the check in anyway and now I have to wait 30 to 60 days to get my money. read the reviews guys.",2025-05-12,3
Not sure yet,2025-05-12,3
cannot login on OPPO Reno12 F 5G colorOS 14.0. used to work great but is not working anymore. after I put credentials on login screen it restarts the application and goes back to screen. I deleted cache and app 3 times and installed it again but it's a consistent bug issue with after logging in.,2025-05-12,3
"terrible they decrease your limit out of the blue affecting my credit score negatively, I will never get another Citi card again, no other credit card company has done this to me",2025-05-11,3
Dunno why these apps feel the need to change the view layout of these apps. I have to scroll down now to pay my bill instead of just swiftly burning through the next buttons. You're not making anything better by adding steps. Obviously bots ramp up the score on these. Just read em. every single day has to reverify device. bs,2025-05-11,3
Horrible. Skips the log in and went straight to my card information.,2025-05-11,3
"I hate it, it's BS, and I will not be forced into using it!!!",2025-05-11,3
this app would be great if it let you make a payment! it just loads for ever and nothing!,2025-05-10,3
not user friendly. keeps demanding i review.,2025-05-10,3
So lagged... won't load any pages,2025-05-10,3
did not make this purchase 19.99 on my card.,2025-05-10,3
do not update it corrupts your app!!! delete app as soon as possible!!!,2025-05-09,3
suddenly my biometrics (fingerprint) login isn't working. I updated and even uninstalled and reinstalled and it still won't work. Please help,2025-05-09,3
Citi somehow manages to always provide the worst customer experience in the USA. They haven't failed to utterly disappoint me even once. congrats,2025-05-09,3
card payment doesn't work. keeps on loading forever. very annoying when you're trying to submit a payment before due date.,2025-05-09,3
"The Flex Spend plan is worthless, unless you like accumulating a balance on your Standard APR while they pay down more than the monthly principal on your Flex plan. Yes, they're ""just following the law"" which states that the highest interest balance must be paid first, so your recent purchases have to go past the grace period and you get hit with that interest before you can apply payment to it. Everything about banks is bull s#!t.",2025-05-09,3
not good,2025-05-09,3
"I hate this app solely because when I am waiting to chat with a human, the app keeps sending me notifications that there's a new message for me, except the new message is that I'm still in line waiting for a human. Then the chat will randomly, so when I restart the chat to speak with a person I'm at the back of the line. An absolutely terrible user experience.",2025-05-09,3
I can't even sign in on the app. I know it's not me because I can sign in online.,2025-05-08,3
"this app is basically unusable. so many areas of the app don't open, it just spins and then you can't go back or do anything but close the app. It's so bad that I'm considering getting rid of this bank all together.",2025-05-08,3
biometrics always resets...,2025-05-08,3
"App continuously gets stuck on a loading screen and times out anytime you try and click on anything. If all you have to do it check balances great, payments and anything else... good luck",2025-05-08,3
Your app is terrible. I have to reset a password every time I try to use it. And reenter my card information.,2025-05-08,3
"Complete garbage, doesn't work.",2025-05-08,3
"it's not working. can't pay you X6 days, and now im late. not happy.",2025-05-08,3
to much interest,2025-05-08,3
"Update: Finally deleted mobile app. Repeatedly experiencing endless buffering when I need to make a payment. Now resorting to using desktop version. It works well when it works but now and then, it will buffer endlessly and it's oddly when I'm trying to schedule payment. Update 1/4/25: Citibank is SUPER FAST responding but....I am back to seeing the endless buffering even after following their fix-it suggestions. And again, it's while I'm trying to make payment.",2025-05-07,3
It has crash on me a few times but all in all i love the citi app far better than the capital one app. I love that my costco rewards are viewable as well. edit: 05/07/25 - app still takes absolutely forever to load. when will they give an update to fix this. its getting to the point im having trouble paying my bill.,2025-05-07,3
never works,2025-05-07,3
doesn't allow me to make a payment. absolutely ridiculous.,2025-05-07,3
Only wish to use desktop. And that is not working with password. Phone too small & don't like the screen clicking. Go back to letting me use the mouse.,2025-05-07,3
Citi Bank is a great bank. The tellers are always so helpful and polite. Even on the phone with the same help. Been banking for 2 years almost 3 . I would not change banks. My money is secure. Thanks Citi Bank,2025-05-06,3
Had always been reliable up to the last month or so... Continuously Hangs up and wont do anything. Now in order to get to the travel booking site you have to go back into this trainwreck to get let in. Hopefully there is an update on the horizon 🙏,2025-05-05,3
I've had nothing but problems with Citi and this app. I can't make a payment to do anything with it but yet one day late they send me an old they send me a charge like $38 something like that because I was one day late then I could make a payment and you can't get ahold of these people.,2025-05-05,3
app not working can't pay my bill!!!,2025-05-05,3
"The app doesn't work well on Android. I'm thinking about putting the credit card on hold, cause using the Citi app really bothers me.",2025-05-05,3
05/2025 All month trying to sign on says choose PIN just spins and spins. Won't let me. 11/05/2024 Playstore updated. Now transaction details won't load. Fix it. It does what I need.,2025-05-04,3
Doesn't recognize store cards (Home Depot & Best Buy) like Synchrony Bank has. very annoying,2025-05-04,3
"Never works, frequently asks to update",2025-05-04,3
Biometric login is a lie and does not function.,2025-05-04,3
Nither the app nor the phone number work to activate a new card. Worst service ever. Do not advise getting credit through them.,2025-05-02,3
"this app is terrible. I can NEVER make payments and because of it, I have missed multiple payments. I have a perfect pay history except with Citi because of this app. PLEASE FIX THIS APP!",2025-05-02,3
nothing but lie and took my money and kept it. customer service did nothing but lie to me and refuse to send my money to me. Do not trust city with your money.,2025-05-02,3
takes forever to load,2025-05-01,3
"This app is basically unusable. It's slow and constantly locks up when your trying to look up history, pay a bill, or anything else. Makes me want to get rid of any Citibank account I own because they are incompetent.",2025-05-01,3
Will not let me download new Citi bank app and now im late,2025-05-01,3
not working well...long loading,2025-05-01,3
"citibank is by far the worst bank you can trust with your money. They have the WORST customer service I've ever encountered. Citibank froze all my accounts and gave me the biggest run around and have yet to explain to me what I did wrong they held my money for weeks putting me behind on rent, bills and even having to borrow money to feed my kids as I found out my accounts where on hold while grocery shopping. I figured I can go into a branch and close and they declined to do so. Horrible!",2025-04-30,3
"I've been costco member for over 20 years , this card charges me interest because I pay more than my previous balance!!!! called them , did not get anything but bull.. , very unhappy and disappointed.",2025-04-30,3
"can't ever make a payment via this app! just spins and spins and spins trying to load. this app is junk. Apparently whoever developed this, never uses Citibank to make a payment on the app - update - 04/29/25 still can't make a payment, the loading circle just spins. this is like month 4 of trying. Have to use my computer to make a payment.",2025-04-30,3
"On any loading screen ,app hangs and I need to restart the app, as long as the loading screen doesn't appear everything works fine. I started seeing this problem only in the last 6 months.",2025-04-30,3
sucks,2025-04-29,3
Not user friendly,2025-04-29,3
"I'm extremely dissatisfied with customer service and support. I received no reminders for my upcoming payment, Ironically, they efficiently reported the missed payment to the credit bureau. It's frustrating to see penalties prioritized over customer support. Until they address these issues, I advise caution and recommend exploring alternative options that prioritize customer satisfaction. One star from me.",2025-04-29,3
Sucks!!! It doesn't allow me to give additional payments probably to charge me the interest!! It's so frustrating!!,2025-04-29,3
it won't let me see my balance or pay my card,2025-04-28,3
"This app has not been working for the past few months. If I click on something it just gives me the circle of death and I can't back out of it... I have to restart the app. I've updated it, restarted my phone, and nothing seems to work.",2025-04-28,3
"This app has not worked for me since I downloaded it. I've tried removing and reinstalling. making sure it's updated. I've cleared the cache or any other advice. the app is forever ""loading"". luckily I can still pay thru the website, its just a pain I can't use the app.",2025-04-28,3
"Biometric unlock hadn't worked for days now, very inconvenient",2025-04-28,3
"So far so good I'm glad I took this step to help better my credit score 7/14/22 as of 04/27/25 i have been denied twice for credit limit increases . I apply for credit limit increases with each card I have all my other cards I get increases 6k, 3k. this Citi card is stuck at 1,100.00 limit . I have excellent credit history excellent, ontime payments, excellent credit score. please reconsider if you plan on getting this card to help your credit score. Do yourself a favor an get better cards.",2025-04-28,3
"Citibank app frustrates me as a frequent traveler and Amazon shopper. Pending transactions deduct instantly, but credits from hotel stays and returns aren't made available right away. Instead, Citibank waits until my account goes negative before applying credits, making me pay twice. Returns come back in small portions rather than full amounts. I'm still waiting on $800+ in credits for weeks. Now I transfer any credit to another bank immediately to avoid Citibank's double-dipping. Avoid this app",2025-04-27,3
good,2025-04-27,3
doesn't work!!!!!,2025-04-27,3
"Using this app blocked all access to my Citi account. I've spoken with nearly 30 Citi reps in the past 3 days, most who can't even speak English, and not one of them has solved my issue. I can't login to pay my bill, and this is going to destroy my credit rating. I am using the remaining balance of my account to hire an attorney to sue them. Avoid this app and Citi at all costs! You've been warned. EDIT: See below, Citi responded and they handle financial issues through X and Facebook. Avoid!",2025-04-26,3
I highly do not recommend. Citi Bank is a terrible company that I have closed my account and will never be do business with again. There are many more better options than Citi Bank!,2025-04-26,3
There's no point of contact like email or something for people overseas. I'm unable to log in nor reach out to anyone through email. No email to reply to its all non monitored. How come it's a one-way communication between me and the bank?! There's no live chat and can't find it anywhere.,2025-04-26,3
they changed your available balance way to often. I have had both increase and large decrease in credit as soon as I paid it to half way paid off they reduced to balance. I paid almost all the balance and they increased. then reduced. it's to unstable,2025-04-26,3
didn't know how bad it was til I switched,2025-04-26,3
"Screwed up login for app. can't do fingerprint anymore. if close keyboard on phone instead of pressing done, app closes. Make sure who you hire is based on quality to fix this. Don't lower standards like you did for this app",2025-04-26,3
"had to have a card reissued because I never received the first one. the app only has the old card information and there's no way to get around it with the new card number. I tried calling tech support but ""Cheryl"" answered with her heavy foreign accent that I could not understand so I had to end that call.",2025-04-25,3
biometrics always have issues,2025-04-25,3
"terrible app, often can't log in because it won't even load the prompt, it just sits there spinning. Seriously makes me reconsider banking with them. Fraud dept also is slow AF and you have to answer a call from a human hours after you've already paid for the thing with another card instead of just getting a text or push notification like my other banks do. I'd give it 0 stars if I could",2025-04-24,3
doesn't work,2025-04-24,3
poor experience slow at ach deposits very sad,2025-04-23,3
"I've gotten 2 notifications saying I have messages in the app, but when I open it, there is nothing there. I've added a payment account and gotten multiple messages from that bank saying it's connected, but the account isn't available to make payments in the app. This app is junk if you can't use it for anything.",2025-04-23,3
App never loads. just the spinning circle forever no matter what I do. I went back to the website.,2025-04-23,3
I don't feel that way anymore 😕,2025-04-23,3
"it is Torture to use this app. over half the time clicking Sign on locks the app with a circle of death. All functions are SLOW. Often there is a ""Try again later"" message. It has been awful for months.",2025-04-23,3
worked very well until the last 6 months or so and now it will only give me snapshots - i can't easily login to pay or view anything additional - it's stuck constantly loading...,2025-04-23,3
When I try to open this app it says I Must update it first ! It doesn't respond when i touch/select the name of the app that said i must update first nothing happens dead,2025-04-23,3
