Review,Date,Stars
05/2025 All month trying to sign on says choose PIN just spins and spins. Won't let me. 11/05/2024 Playstore updated. Now transaction details won't load. Fix it. It does what I need.,2025-05-04,4
Doesn't recognize store cards (Home Depot & Best Buy) like Synchrony Bank has. very annoying,2025-05-04,4
"Never works, frequently asks to update",2025-05-04,4
Biometric login is a lie and does not function.,2025-05-04,4
Nither the app nor the phone number work to activate a new card. Worst service ever. Do not advise getting credit through them.,2025-05-02,4
"this app is terrible. I can NEVER make payments and because of it, I have missed multiple payments. I have a perfect pay history except with Citi because of this app. PLEASE FIX THIS APP!",2025-05-02,4
nothing but lie and took my money and kept it. customer service did nothing but lie to me and refuse to send my money to me. Do not trust city with your money.,2025-05-02,4
takes forever to load,2025-05-01,4
"This app is basically unusable. It's slow and constantly locks up when your trying to look up history, pay a bill, or anything else. Makes me want to get rid of any Citibank account I own because they are incompetent.",2025-05-01,4
Will not let me download new Citi bank app and now im late,2025-05-01,4
not working well...long loading,2025-05-01,4
"citibank is by far the worst bank you can trust with your money. They have the WORST customer service I've ever encountered. Citibank froze all my accounts and gave me the biggest run around and have yet to explain to me what I did wrong they held my money for weeks putting me behind on rent, bills and even having to borrow money to feed my kids as I found out my accounts where on hold while grocery shopping. I figured I can go into a branch and close and they declined to do so. Horrible!",2025-04-30,4
"I've been costco member for over 20 years , this card charges me interest because I pay more than my previous balance!!!! called them , did not get anything but bull.. , very unhappy and disappointed.",2025-04-30,4
"can't ever make a payment via this app! just spins and spins and spins trying to load. this app is junk. Apparently whoever developed this, never uses Citibank to make a payment on the app - update - 04/29/25 still can't make a payment, the loading circle just spins. this is like month 4 of trying. Have to use my computer to make a payment.",2025-04-30,4
"On any loading screen ,app hangs and I need to restart the app, as long as the loading screen doesn't appear everything works fine. I started seeing this problem only in the last 6 months.",2025-04-30,4
sucks,2025-04-29,4
Not user friendly,2025-04-29,4
"I'm extremely dissatisfied with customer service and support. I received no reminders for my upcoming payment, Ironically, they efficiently reported the missed payment to the credit bureau. It's frustrating to see penalties prioritized over customer support. Until they address these issues, I advise caution and recommend exploring alternative options that prioritize customer satisfaction. One star from me.",2025-04-29,4
Sucks!!! It doesn't allow me to give additional payments probably to charge me the interest!! It's so frustrating!!,2025-04-29,4
it won't let me see my balance or pay my card,2025-04-28,4
"This app has not been working for the past few months. If I click on something it just gives me the circle of death and I can't back out of it... I have to restart the app. I've updated it, restarted my phone, and nothing seems to work.",2025-04-28,4
"This app has not worked for me since I downloaded it. I've tried removing and reinstalling. making sure it's updated. I've cleared the cache or any other advice. the app is forever ""loading"". luckily I can still pay thru the website, its just a pain I can't use the app.",2025-04-28,4
"Biometric unlock hadn't worked for days now, very inconvenient",2025-04-28,4
"So far so good I'm glad I took this step to help better my credit score 7/14/22 as of 04/27/25 i have been denied twice for credit limit increases . I apply for credit limit increases with each card I have all my other cards I get increases 6k, 3k. this Citi card is stuck at 1,100.00 limit . I have excellent credit history excellent, ontime payments, excellent credit score. please reconsider if you plan on getting this card to help your credit score. Do yourself a favor an get better cards.",2025-04-28,4
"Citibank app frustrates me as a frequent traveler and Amazon shopper. Pending transactions deduct instantly, but credits from hotel stays and returns aren't made available right away. Instead, Citibank waits until my account goes negative before applying credits, making me pay twice. Returns come back in small portions rather than full amounts. I'm still waiting on $800+ in credits for weeks. Now I transfer any credit to another bank immediately to avoid Citibank's double-dipping. Avoid this app",2025-04-27,4
good,2025-04-27,4
doesn't work!!!!!,2025-04-27,4
"Using this app blocked all access to my Citi account. I've spoken with nearly 30 Citi reps in the past 3 days, most who can't even speak English, and not one of them has solved my issue. I can't login to pay my bill, and this is going to destroy my credit rating. I am using the remaining balance of my account to hire an attorney to sue them. Avoid this app and Citi at all costs! You've been warned. EDIT: See below, Citi responded and they handle financial issues through X and Facebook. Avoid!",2025-04-26,4
I highly do not recommend. Citi Bank is a terrible company that I have closed my account and will never be do business with again. There are many more better options than Citi Bank!,2025-04-26,4
There's no point of contact like email or something for people overseas. I'm unable to log in nor reach out to anyone through email. No email to reply to its all non monitored. How come it's a one-way communication between me and the bank?! There's no live chat and can't find it anywhere.,2025-04-26,4
they changed your available balance way to often. I have had both increase and large decrease in credit as soon as I paid it to half way paid off they reduced to balance. I paid almost all the balance and they increased. then reduced. it's to unstable,2025-04-26,4
didn't know how bad it was til I switched,2025-04-26,4
"Screwed up login for app. can't do fingerprint anymore. if close keyboard on phone instead of pressing done, app closes. Make sure who you hire is based on quality to fix this. Don't lower standards like you did for this app",2025-04-26,4
"had to have a card reissued because I never received the first one. the app only has the old card information and there's no way to get around it with the new card number. I tried calling tech support but ""Cheryl"" answered with her heavy foreign accent that I could not understand so I had to end that call.",2025-04-25,4
biometrics always have issues,2025-04-25,4
"terrible app, often can't log in because it won't even load the prompt, it just sits there spinning. Seriously makes me reconsider banking with them. Fraud dept also is slow AF and you have to answer a call from a human hours after you've already paid for the thing with another card instead of just getting a text or push notification like my other banks do. I'd give it 0 stars if I could",2025-04-24,4
doesn't work,2025-04-24,4
poor experience slow at ach deposits very sad,2025-04-23,4
"I've gotten 2 notifications saying I have messages in the app, but when I open it, there is nothing there. I've added a payment account and gotten multiple messages from that bank saying it's connected, but the account isn't available to make payments in the app. This app is junk if you can't use it for anything.",2025-04-23,4
App never loads. just the spinning circle forever no matter what I do. I went back to the website.,2025-04-23,4
I don't feel that way anymore 😕,2025-04-23,4
"it is Torture to use this app. over half the time clicking Sign on locks the app with a circle of death. All functions are SLOW. Often there is a ""Try again later"" message. It has been awful for months.",2025-04-23,4
worked very well until the last 6 months or so and now it will only give me snapshots - i can't easily login to pay or view anything additional - it's stuck constantly loading...,2025-04-23,4
When I try to open this app it says I Must update it first ! It doesn't respond when i touch/select the name of the app that said i must update first nothing happens dead,2025-04-23,4
"Literally never works!! Because of this, either I forget about my payment and then get charged an arm and a leg for late fees, OR I need to remember find time to use the website, remember my log in information to make a timely payment.... Why even have an app if you as a company are just gonna make it not work?? This seems like a purposeful exploitation your consumers with ADHD. Thanks for the CC approval and promises of kickbacks, but why bother if you make it so hard to make payments?!?!",2025-04-22,4
"App gets stuck loading with the spinning wheel anytime I try to navigate through any tab or link. It's insanely bugged & broken and needs fixed. The app is worthless at this juncture. It should be taken off the app store until it's fixed. There are many other reviews like this one, and it seems the issues have yet to be mitigated . . .",2025-04-22,4
over the moon pissed at Citibank. worst customer service possible and I had had my account with them for over 10 years have never had a single late payment and have a Stellar credit score. I was just treated so poorly by customer service I will never use this company for anything ever again!!!,2025-04-22,4
too difficult to use,2025-04-22,4
can't load payment page,2025-04-22,4
"For at least the last month, the app keeps resetting where I have to completely log back in. Then I also have to set up my fingerprint or pin again, except that only sometimes goes through correctly. Other times, it fails to update and I have to do it all again. The app used to be completely fine and was easy to use, but now it's an extra annoyance just to check my statement as far as playing the will-it-won't-it log in properly game.",2025-04-22,4
"Any time I click something in the app, I get the spiral of death. The app has been virtually useless for about 4-6 months. Mobile banking is a must. I'm considering closing my account because I can't 'write things down for later when I'm in front of a computer'",2025-04-22,4
takes too long to load to do anything very very inconvenient if you need to make payments and things,2025-04-21,4
it's the least performant bank app. it opens quickly but when you click on any where it just spins. I am trying to make a payment for the last 20 minutes but it's just spinning. please fix it,2025-04-21,4
Been trying to update this app for months no luck,2025-04-20,4
your app isn't compatible with my phone..,2025-04-20,4
horrible,2025-04-20,4
"App stated that I neede to update, it doesn't work! I uninstalled and now it show ""will install soon"" What the heck is that?! I've been waiting for literally 2 weeks now and nothing! This is so annoying 😑",2025-04-20,4
"Wanted to use the app to manage my Home Depot store card (issued through Citi) and another store card I just opened. However, the app will not let me register the Home Depot card. All of my info is correct (card number, cvv, ssn), but it tells me something is wrong. Oh well.",2025-04-20,4
so very hard to log in. then the customer service wait. then the magic word... so vague you get locked out easily,2025-04-20,4
can't log in,2025-04-20,4
anytime you go to pay a bill or do something important it just freezes on you,2025-04-19,4
my info is spot on. why can't I pay mybill?,2025-04-19,4
I did not change to AUTOPAY. WHERE IS MY BILL IN THE MAIL?,2025-04-19,4
Fingerprint sign in is not working. It is turned on in settings. I open the app and it does not pop up. I tap the fingerprint icon on the login screen and I see a spinning wheel for a moment but nothing else happens. I tried turning it back off and on but it still doesn't work. I have 2FA turned on.,2025-04-19,4
"Won't work with Galaxy S8. They ""reviewed"" my issue. The app doesnt work with Galaxy S8.",2025-04-19,4
login issues,2025-04-19,4
not open easily all time problem,2025-04-19,4
crashes app after clicking anything.,2025-04-18,4
my account has been locked for 5 months now. Citi doesn't have employees with brains so every time I call and tell them my account is locked they tell me to clear my cookies. the app is garbage like the bank.,2025-04-18,4
I don't know what trail deposit your talking about but I put the information in to use make payment. I guess cancel the card. go somewhere else.,2025-04-18,4
I was using the app for over a year with no problems then I was cleaning up my phone and using the Samsung tool to uninstall and delete unwanted/unused items and apps and for some reason it included the Citibank app. When I went to download it again from the store it says my phone is not compatible with the app even though I was using it prior to the uninstall. absolutely ridiculous!,2025-04-18,4
not user friendly,2025-04-18,4
Does not work on pixel 8a ****** Update in April 2025. Still does not work on Pixel phones.,2025-04-18,4
"I just updated app, had forgotten password and it isn't letting me reset password. I have even uninstalled than reinstalled with no luck for it in allowing me to do so!",2025-04-18,4
Never works. I just sign in and it just spins forever. Not even sure why I try anymore. Such a poor reflection on the company to have an app that doesn't work,2025-04-18,4
this will not load,2025-04-18,4
"Click on anything, won't open just thinks about it.",2025-04-17,4
Too difficult to sign in,2025-04-17,4
miss information,2025-04-17,4
can't log in,2025-04-16,4
joke of a bank 829 credit score. over $2m cash/stock $1500 limit with citi 240k approx total credit card limit 1400 approx balance across ALL citi steals payments for about 10 days before applying to the joke of a credit limit. currently balance zero available 8.78 under $10. not a typo ALL payments cleared my checking account 5 or more days ago. what a joke.... Thanks for the very quick reply. unfortunately I've tried 6 times in 10 days. Even supervisor level don't speak English well enough.,2025-04-16,4
will not let me cancel the card,2025-04-16,4
not user friendly,2025-04-16,4
"The App is getting better, but still needs AI. I am going to upgrade the rate to 4 stars.",2025-04-16,4
does not work. can't get my statement??,2025-04-16,4
months issues loading,2025-04-16,4
"limits the amount of payments you can do a day. ended up owing interest because your app won't allow me to pay my balance off the same day, because I have money in more accounts. I'm getting frustrated with all your nickel and diming fees and interest on technicalities. looking at other options...",2025-04-16,4
this application is horrendous. it's costing me money because of the problems I've encountered. I added my savings to make a payment. made the payment and then it pulled from my checking. due to the issues in the application it's cost me 130$ because it won't stop. citi refuses to help as well. citi is still refusing to refund my money due to their warranty program. You are better off paying online. you have been warned.,2025-04-16,4
Not loading despite repeated attempts.,2025-04-15,4
"The app used to work great. Now anytime I try to make a payment or look at anything on the app, the circle of death appears. I can't do anything with the app. It's frustrating that a banking type app wouldn't work properly. Seriously, get it together. The amount of interest you charge should be plenty of money to fix your glitchy app!",2025-04-15,4
"biometric login has been broken on pixel 8a for a while now. Throws an error or just doesn't work. I click the fingerprint, nothing happens, click it again and hold where I think the finger print scanner on the screen is and nothing happens. Eventually a pop up comes up saying something like contact technical support. edit: Moving to one star after my interactions with support. They just keep kicking the can.",2025-04-15,4
"Horrible experience, my phone is not outdated or anything, i don't understand why the app is so slow and does not let me see statements or any of my credit card i been months having to pay the credit card through my computer. Urgently fix this please. I been giving time to see if it's fixed but it's been months of the same thing.",2025-04-15,4
this app is terrible. it's so slow it's unusable. the website is just as slow.,2025-04-15,4
Once you use your card a lot. They lower your credit limit which I don't understand because I've paid my bill on time every time. But use it a lot and because I use it a lot. Say have lower my limit. Why give credit limits for us to use? And then we use them and you know with them!,2025-04-15,4
app does not work,2025-04-15,4
Very buggy...I can't log on unless I give more permissions?! Since when? Update: A weird message I hadn't seen before wanted me to give Google Play access to my files on my phone? Felt like I was being hacked and unable to log in at all; ended uninstalling and installing the app. The odd message disappeared. Please make sure your app is safe and wasn't hacked yesterday.,2025-04-15,4
"this is a predatory bank, it's almost impossible to pay a credit card through the app or website. I think everything is messed up in purpose to charge us late fees and mess up our credit, when my auto-pay doesn't go through they give me a short call just to pretend they tried to reach me. I have 2 cards one Macys, and the other best buy... both of them are the same ridiculous unresponsive software. Citi should be responsible for this scamming scheme",2025-04-15,4
will not open or process,2025-04-14,4
Customer service is terrible! They randomly locked me out of my account and they make you jump through so many useless hoops over the phone just to be able to unlock.,2025-04-14,4
"Citibank blocked my account for no reason again!!! Citibank has the worst customer service ever. I see why Citibank has a F+ rating. Do not trust this bank! The fraud department is only open during the week and they don't not unblocking your after verifying your identity. Citibank will tell you to wait 24 hours. OMG. Stay away from this bank, fraudster",2025-04-14,4
The biometrics don't work. In fact it just doesn't show up anymore as an option when I launch the app even though I have it turned on in the settings. The customer support number for online banking just wants to read off my account balance and is useless in trying to solve this issue.,2025-04-14,4
my card is being mailed to me. How can I track my card coming in the mail?,2025-04-14,4
takes me over 5 mins to log in every time,2025-04-13,4
This app takes the record for the worst app from any fortune 500 company. Complete and utter trash. I have to log into the website to do basic things. Useless and only good for looking at your balance.,2025-04-13,4
yuck,2025-04-13,4
making a payment of the app is impossible,2025-04-13,4
"Just downloaded it, it's useless. I had to go to my computer to create the login, it hung every time. After establishing my bona fides, I came back and found it only shows my the first page and fails to go anywhere else. Whoever is in charge of this app needs to learn programming, a two year old with an etch-A-sketch would be more accessible. Edit: using Samsung Galaxy Note 5. Re-edit: Answer: android 14, OS 6.1.1",2025-04-13,4
up dating every week is BS,2025-04-13,4
this is the worse bank I have ever dealt with you can't even anyone that speaks understandable English,2025-04-12,4
Easy to use,2025-04-12,4
actually the worst bank ever thats why so many people have problems with it. they closed my account down because they said I made a small check deposit of $4!! True story! now my account is closed! STAY AWAY,2025-04-12,4
"This app used to be really nice, but now it freezes when I try to make a payment or view any details of my account. I have to use the desktop site now to make a payment, so the app is pretty much useless beyond seeing the current balance.",2025-04-11,4
"Again!? Too many updates!!useless updates, uses too much of my memory MB, time to pay off the card and find a better app with less updates! Citi, More is not always better , it's just more!! !!!",2025-04-11,4
Freezes when trying to make payment or sign on. Have to call second time this month to make my payment. Extremely annoying and inconvenient.,2025-04-11,4
biometrics don't work & major delay on fraud alert.,2025-04-11,4
dont like to keep updating,2025-04-11,4
App is very buggy. Very hard to use. Hard to set up biometrics. Hard to change password. Won't let you save your password anywhere so you can get back into the account without resetting your password if you forget it. Very unuser friendly,2025-04-11,4
the worst bank you can join. they are actually scammers,2025-04-11,4
"Since few months ago, my Biometric login was suddenly unenrolled, and when I tried to enroll it back, ""Something went wrong"", great app 😆",2025-04-10,4
can't even use my card,2025-04-10,4
"I am new to Citi Bank and installed their mobile app and it freezes 90% of the time when navigating from the home page, 90% of the time you'll get a spinning page. I have reinstalled the app a few times and restarted my cell as part of the process to no avail...",2025-04-10,4
too much ads!!!!,2025-04-10,4
"Changed my previous 5 star rating to 1, but I'd give zero stars if I could. Citi Visa raised interest rates by 4% with the only explanation that they were doing this to all Costco Visa card products. My credit score is exceptional, and I always pay on time. This is unacceptable. I hope Costco changes credit cards so their customers get the great service they usually expect. I will be canceling my Citi Visa",2025-04-10,4
"it worked great i was able do mobile deposit. I was able talk to a live person. that all changed. I have the same checks signed by the same person no longer can I deposit, and no longer can I ask a human being why. I will be switching banks due to it.",2025-04-10,4
"I was charged 75 dollars for buying two sodas while in the VA hospital. what a rip off, closed the account ASAP",2025-04-09,4
"Careful because they use bait and switch techniques. Approximately 1 month ago (Mid march) we were offered zero interest until the end of October 2025. Click a button on the app to activate. We called Citi customer service to confirm the promotion and were told it went through. Today, April 9th, I was reviewing the app, and the zero percent did not show up. We called customer service again and were told it didn't go through after making a major purchase. Don't trust them!",2025-04-09,4
The feedback request prevents me from going back to my account. I'm going to have to close it and log back in. Very annoying. The rest of the app is fine but you failed on this one.,2025-04-09,4
this app is horrible and youll try to charge me a late fee,2025-04-09,4
I haven't even got the Dam App open yet.,2025-04-08,4
click on any of the settings and it is just a constant loading wheel. This app is almost completely useless...,2025-04-08,4
This app is now going down hill. Each update makes it harder to login or manage your account. This app used to be good but now it takes 20min to login if it login at all. Hopefully they can turn this ship around. On a P9P.,2025-04-08,4
worst software ever,2025-04-08,4
I can't register my new Costco Citi Visa. I am no longer the primary. I am now the authorized secondary after my husband's new care. I activated my card but now can't see what my balances are or how much I spent or ANYTHING!,2025-04-07,4
"the app won't allow me to officially register. it keeps asking me for a secure word. when I enter one, it says it incorrect.",2025-04-07,4
"Bit slow. But once in...works perfectly. Edit 3/14/25 : Changing from four to ONE star. The response on this app has become RIDICULOUSLY slow. Surprising coming from such a HUGE company. If CITI can't manage a simple app, not sure how they will handle one's investments. Update 4/7/2025 : Closing my accounts(checking and 2 CCs) and going back to Chase. I travel all the time and I can't afford to have such a USELESS banking app. On the computer, everything is great.",2025-04-07,4
Never worķed correctly. Would not let me open or update.,2025-04-07,4
I can't update it to my phone anymore.,2025-04-07,4
"when I try to log in, it just stalls out",2025-04-07,4
"Does not display correctly the scheduled payments. Does not inform when a duplicate payment is made. When a check is cashed it can overdraw the account, but if it is a scheduled payment it won't. very weird. no option to stop a bill payment after it is made or to dispute it.",2025-04-07,4
For months now the app is basically useless. I can almost never navigate from more than the main login view. As soon as I click on anything the app just shows the circle of death and never navigates to what I've clicked on. Very inconvenient when I'm not in front of my laptop to execute the action. Please get the bugs worked out so I don't have to leave Citi.,2025-04-06,4
"Don't do it. If you are out of your home State, your charges will be declined and they will not help you. Disappointed after 3 years.",2025-04-05,4
so disappointed 😞 password I'm literally looking at online does not work with the app. tried to reset but the text code is too long to remember to retype & can't copy - the call option demands Users enter letters on a keyboard with only numbers. Def not UATd well The same password works via same mobile on mbl Chrome. Don't bother with the app.,2025-04-04,4
The security settings need to redo.,2025-04-04,4
Finger print recognition no longer works for login.,2025-04-04,4
