Review,Date,Stars
"the app hasn't worked for weeks and there is no help from customer service. I've tried to report the issue but get no response. I guess no one at Wells Fargo cares that there app doesn't work. Every time I try to login a message says ""we are not able to complete your request at this time."" Same thing happens on my husband's app. I can login just fine online but not the app. Someone should fix this!!!!",2025-03-28,4
my phone won't update new version of this app. And from what I'm hearing it's not very reliable.,2025-03-27,4
it's so annoying that WF requires users to update their mobile app every month 👎☹.,2025-03-27,4
bad bank they really put my money on fraud cause they don't know the company that wrote the checks. they been holding my money for over a week now. they won't even close my account is was even lied to just to get my business. I was told I will get my money the next day then turn around and pushed my money back and week then going to say the checks are fraud. since I open my account on the 20th of March I had to call wells fargo over 25 times still no help !!!!!!!!,2025-03-27,4
daily deposit limit is stupid,2025-03-26,4
Shame on Wells Fargo. Because their app didn't lock and someone used my phone and transferred $1800 and they refuse to reimburse me for it. The last of my savings and now my two kids and I are going to be homeless with no income due to my high risk pregnancy and their blaming me and taking sides with a scammer to let them keep the money. SHAME ON YOU ALL AT WELLS FARGO.,2025-03-26,4
"31 million $ to CEO, can't get the drive-through up and running, and can't stay open until 6. Still blaming covid.",2025-03-26,4
with any this new stuff. I am old lady and still like old ways.,2025-03-26,4
pri vacy,2025-03-25,4
you have allowed a Robbery via my account $1679.00,2025-03-25,4
very very difficult to get into account,2025-03-25,4
collecting personal data ... selling days,2025-03-24,4
No app available for iPhone,2025-03-24,4
"unreliable, non intuitive. The app is mostly trash, but it is the only option they give us. Wells, along with all the American corporations, dont care about us, the customer. I can't even understand the operators that provide me with ""customer service""... In the unlikely event I make it passed the switch board designed to frustrate customers.",2025-03-23,4
secret shared accounts with who??,2025-03-23,4
"loved the app, but it's no longer available for my phone & can't afford a newer phone.",2025-03-22,4
this app is very difficult to use and login to,2025-03-22,4
Trying to get an online checking banking application and it's very hard questions are asked and the ones we need are not there.,2025-03-22,4
it forces me to reset my password every time I try to use it,2025-03-22,4
Won't cover impersonation fraud. Time for a new bank!,2025-03-21,4
unable to add text banking. have tried numerous ways,2025-03-21,4
worst bank on planet,2025-03-21,4
I KNOW the star rating is made up for this app. Because this is thee worst bank EVER.,2025-03-21,4
have tried enrolling several times and it will not let me,2025-03-21,4
All I get is the run around. You tell me to upgrade. When I try the system says it's not compatible with my phone. What is a customer to do?!?,2025-03-21,4
"Now that I can't download the app because it says my phone isn't compatible with Verizon, I am very disappointed that I cannot make a check deposit on the app... Come on Wells Fargo, make it easy like it used to be. thank you!",2025-03-20,4
"it is ridiculous how this bank takes to long to process my payments, they are always pending pending pending it informs me how much I have remaining but after the pending has been processed you take out more again I feel like somehow I'm being double charged after the pending is completed....it is ridiculous to have pending charges for 5 days when the funds are there",2025-03-20,4
unable to use it,2025-03-20,4
Horrible experience. Wells Fargo keeps proving everyone they are the worst bank in the making. If you have a small business you will regret using this app and services,2025-03-18,4
terrible can't get in really bad instructions,2025-03-18,4
monthly fee,2025-03-18,4
Worst Bank and App there possibly is.,2025-03-17,4
act like u have a account issuing u a card but won't approve you having them as a bank account that's bs,2025-03-17,4
Racist policies,2025-03-17,4
So many issues with this app,2025-03-16,4
"When you click on notifications, they don’t display the related content—you have to find it yourself. It also shows a link for CD applications, but after answering all the questions, you’re told to visit a branch to complete it! Feels like a waste of time.",2025-03-15,4
"Now a new PW every time the little bit I log on.This app is as bad as the website... The inability to modify mortgage payments on the fly is ludicrous! Am I understanding this correctly? I need to cancel my existing reoccurring mortgage payment first rather than just making an edit to it...Then, I can't even create a new reoccurring payment today, I must wait till tomorrow to make that happen??? THAT IS RIDICULOUS! It should say View, EDIT, Delete and not just View/Delete. What an inconvenience.",2025-03-15,4
"Wells fargo is doing "" savings as you go"" transfers without my consent. I never even agreed to the legal terms yet. Is this legal?",2025-03-15,4
"It doesn't recognize my user and password, so I am unable to use the app.",2025-03-14,4
App does not work well. Tried to explain to customer service they hung up.,2025-03-14,4
I can't wait to switch banks. I'd get rid of this app if it wasn't a requirement for mobile check deposits.,2025-03-13,4
"Scammers shouldn't be allowed to run companies. After you scammed hundreds of millions of dollars in 2019, you should have lost your business license. Edit: I've already told you here; there's no need to email or call you. I'm not giving scammers my name, phone number, or email address. Nice try, though.",2025-03-13,4
because you keep asking me to rate you. nah. I'm good fam. I'm not gonna do that Ludwig.,2025-03-13,4
"Annoying ""Time to set up your card - Let's go"" popup stays on home screen permanently even when you set up everything already, please get rid of it",2025-03-13,4
Sucks very much! took about 3 days to Zelle my landlord a payment just because my number changed in my account. now I have to pay a late fee,2025-03-13,4
"What's the point in having zelle if it always breaks? ""Sorry for the inconvenience"" ya. Sorry for using a different bank.",2025-03-13,4
Can't delete more than one message at a time.,2025-05-20,4
"Every time I sign in for the past few weeks, it signs me off and I have to force stop the app. It's frustrating at this point since it's so constant.",2025-05-17,4
"I had a problem with my bank account so it got suspended. I received an email saying ""call immediately, to get your account reactivated"", so I called and I was told that they couldn't reactivate it for 30days. the email lied so I feel like wells Fargo lied to me.",2025-05-15,4
bad bank,2025-05-13,4
"App can't read the front of checks, makes depositing impossible",2025-05-12,4
App works great but I'll give 5 stars when I can put my accounts in custom order. Update from 12/24 - still can't custom order the accounts like you can online. So down another star for that!,2025-05-09,4
customer service. is weaking,2025-05-08,4
"not happy with having to pay an account fee after I was told I wasn't going to be charged,, such liars 😔",2025-05-06,4
can't use zelle tried to verify my phone number at least 6-7 times still never got done and they don't like when you file disputes they said it's a waste of money to them thats what the agent said to me sorry company I'm closing my account,2025-05-04,4
"Inconvenient. Inefficient. It takes tons of clicks to accomplish a basic thing. Ads for other companies found their way inside this app. And every time I uninstall it, it is still magically on my phone . . .",2025-05-02,4
"I do not like the limit on mobile deposits of $5000. I should be able to deposit any amount to my account. It's asinine to limit deposits, and I am not near any WF branches.",2025-05-01,4
glitches in the app,2025-04-30,4
App will not let me log in with 2 step verification?? please fix I need my money!,2025-04-30,4
messes up cant access my money or anything,2025-04-29,4
very slow response. you click anything and wait every button you click and you wait and wait,2025-04-27,4
Used to like this bank but the fees for overdraft are ridiculous and the overdraft protection is essentially just taking money from your own savings. Also there's limited locations atms and no perks/rewards for longtime good customers which is disappointing. I have decided to switch banks,2025-04-26,4
Did not deposit last to time I deposited with no warnings,2025-04-20,4
"why does my mobile app keep crashing, never had issues before today",2025-04-20,4
"cannot use app, seems my phone is too old.",2025-04-16,4
the app won't accept my new password when I put it in says user/password not recognized but works fine on desktop browsers,2025-04-11,4
can't log into my account even tho I have a savings account,2025-04-08,4
"Initial reaction: I normally copy and paste passwords from secure storage. A long-press in a password field, rather than providing an option to paste (or copy) the password, opened the print page function (WTH?). What is the logic behind that, if any? If using a shared printer: you just printed a sheet with ""Wells Fargo"", your username and password.",2025-04-07,4
did not receive otp,2025-04-07,4
I don't understand all these new changes.,2025-04-07,4
doesn't always work but its the only option I have,2025-04-06,4
to many permissions for this app sucks,2025-04-05,4
I hate the fact that every time I get on here to check something I have to upgrade can't you keep it more than a month gee whiz this is crazy,2025-04-05,4
good luck copy and pasting anything in this app. cannot even paste an otp - it opens a print dialogue. horrible ux that makes it clear they haven't put basic testing in place,2025-04-03,4
much difficult,2025-04-03,4
not working for year 2025,2025-04-01,4
"Push notifications don't work. EVER. No matter what I do, they WON'T WORK. Update 3/30 : also seems that there is no longer a way to get transaction notifications or notifications of any kind. Down an additional star.",2025-03-30,4
closing banks and limiting online deposit amounts is not productive,2025-03-26,4
Biometrics for this app fails 95% of the time.,2025-03-26,4
"hard to connect frim mountains. lake county, ca",2025-03-25,4
mobile deposit is sketchy. No confirmation of check routing and account # provided.,2025-03-24,4
"I used to be able to do mobile deposits just fine. For the past month now, I have had to do trips to the branch to deposit my checks. So annoying",2025-03-22,4
I'm not satisfied with wells fargo. I've been a member of wachovia for 12 years and now it's wells fargo and wells fargo isn't going to be my bank for long..I am truly disappointed that this bank wouldn't let a payment go through for a dollar and some change. I'm changing my financial institution next month. so I don't have any more to say,2025-03-21,4
"this app is awful. It's boring. weird, it gives hard time. more than 6 months I've never opened my account. Danm it! I'm so frustrated.",2025-03-19,4
why is that sometimes it will count pending charge in your overall balance and sometimes it doesn't. it should be one or the other cause when I do the math after everything it feels like wells Fargo has designed an app to fugde the numbers somewhat. other apps can show me the true amount just fine every time why can't wells fargo. it's not clarification that's needed its why the decision was made to have the literal calculator not show all totals. i have left this in the feedback multiple times,2025-03-18,4
"You keep having trouble matching the check amount in the picture your app took to the amount I entered for my deposit. I do not like deposit apps that take pix themselves, they take pics too quickly and don't allow for time to center or adjust picture placement. The amounts were identical after the two tries so I don't know why your app had issues",2025-03-15,4
"The app is simply ""ok"" for seeing what you need to. The statements are easy to grab unless it's recent transactions you're looking for. My huge gripe is that the transaction dates are always inaccurate. If you need to know what day you made a transaction then too bad, it's going to be a list of transactions that all have the same post date. Very annoying.",2025-03-14,4
"App definitely slow to process things you do, it's 2025 were instant is definitely capable. These banks need to step their game up",2025-03-14,4
"right in the middle of a transfer while waiting for a code, not sure what happened, think it timed out, not even 2 minutes. Had to do it all over again.",2025-03-14,4
"I love the app when it works. but hate when it glitches. lol this weird app once told me that I have -1000 dollars on my newly just opened debit account, and then after I deleted the app and re-downloaded it and then reloged in. the account was back to 0, and I had no negative charge. another time, my brother sent me money via zelle using Wells fargo. and I was outside my home with a full service bar. yet it told my brother that the money was sent. and I received nothing. until I went back home.",2025-03-14,4
No 2 day early direct deposit. Ever. 12 hrs average. Now not even that. Might make it to work tomorrow. Thanks.,2025-03-13,4
Poor so far,2025-03-13,4
"I'm a new customer, and I am not feeling valued",2025-03-13,4
"The app is better than some and worse than other, but be assured, if they are having system issues, you may as well try another day. Today, secondary verification did not work (text), so the app recommended try another method. So I tried email to verify my account, however, that system was down also, so I was instructed to try another method. This time I tried phone. Got the recording, which required any WF card number. Then it asked for the pin for my debit card only to be put into a hold que.",2025-03-12,4
Mobile deposit seems to always have issued capturing your checks.,2025-03-11,4
"First time I used the deposit feature at Wells Fargo and not real smooth. kept asking me for the correct amount on the check, which was the correct amount that I entered.",2025-03-10,4
I can’t install the app in this phone,2025-03-10,4
"Kinda need this for alot of everything, unfortunately I no longer have access because of this update, big sad, am broke, no money",2025-03-06,4
"I am trying to send money from my account using Zelle, but WF is not allowing it to happen and will not give me a reason why. so now my simple transaction is turning into a long phone call.",2025-03-05,4
App is doing as expected,2025-03-03,4
"Please fix Zelle, trying to send friends money for a recent vacation and it says I'm only allowed to send 1 money for my own protection?? The whole point of Zelle is to send money, this message defeats the whole purpose.",2025-03-02,4
Wells Fargo bank is doing the bare minimum... Thank you.,2025-03-02,4
easy to use!,2025-03-01,4
"Stop making me change my damn username and password every other month, I'm gonna switch banks",2025-02-28,4
It is a buggy piece of garbage. I will probably pay this credit card off just to get rid of it to not have to use this app. It crashes and is frustrating.,2025-02-26,4
Slow to load. I don't know why WF insists on showing you ads before seeing your accounts. App is buggy as hell. Try transferring money and the fields are grayed out. Some bank.,2025-02-25,4
Stiff app. You cannot use this app correctly unless you own an active US phone number. You cannot choose other types of verification. Only works with phone verifications. Do youself a favor and just download Revolut.,2025-02-24,4
Revisions disappointing. Previously able to view face of checks issued to see payee. Not now.,2025-02-24,4
No practical use for me.,2025-02-23,4
Biometric sign-on never works. I can unlock my phone just fine with biometrics though.....,2025-02-20,4
Wells Fargo/ First National etc. customer since 1970. Customer service has eroded to the point they want a no cash customer base. No more coin counting machines and they force you to fill coin rolls if you want to deposit them. They're heading to online banking only so they can fire as many employees as possible. Thankfully my other bank values their customers and happily excepts my coins into their counting machines.,2025-02-19,4
😕 confused,2025-02-17,4
"Functions well, with few glitches, however I was woken up by a notification about the monthly credit score update the app gives because this time, it decided to do it at 3am. I did not tell it to notify me of this, it just began doing so.",2025-02-17,4
Too difficult to log in and I can't receive texts on my Guam (local) phone,2025-02-16,4
"The app is fine function wise, but it really should have a feature that allows you to reorder how your accounts are displayed. My primary account is always displayed at the bottom for some reason, and it's obnoxious.",2025-02-16,4
Ok,2025-02-15,4
"sometimes it takes days (weekdays also) for this bank to adjust your account. It's almost like they want you to either overdraft or mess something up so that you can get fee's added on. Edit; the app for this Bank is literally not working or down all the time. I mean, come on, get with the times. If I wanted to use a terrible bank I would have stayed with Bank of America.",2025-02-13,4
mercury online much better,2025-02-11,4
"glitchy, crashes at the drop of a hat or doesn't properly load new pages, lacks quite a few features i'd want. i hate that you can't disable the AI functions, i don't need AI in my banking app",2025-02-07,4
Had to disable all notifications from the app because there's no other way to disable the marketing spam push notifications.,2025-02-07,4
can not adjust transfer limits. Set at $500.,2025-02-06,4
hard to capture pictures,2025-02-05,4
"Dark mode please, the white is to much for night viewing. If possible then I'll review it with higher score.",2025-02-04,4
Switched to a different bank because wells fargo likes to steal your money for no apparent reason and won't even give it back no matter how much you report to them about it.,2025-02-02,4
It sucks. Can't make a purchase because it refuses them all. Can't get past that page for it to approve I'm so tired of not being able to use my card I'm ready to move out of your bank and tell everyone about what you do,2025-02-01,4
"Mobile deposits used to be available right away, but everything changed about a month ago now I have to wait 2 to 4 days horrible",2025-01-31,4
deposits are a pain when the camera auto take the image and doesnt even attempt to focus the image first.,2025-01-31,4
Good,2025-01-30,4
"UX is really rough especially the login screen. It's a real challenge. Maybe on purpose for security? But it fails unexpectedly all the time. Even after you login you are barraged by upsells ads and interruptions. Some features open in an embedded browser which makes you log in again, your auth session doesn't go with you.",2025-01-27,4
Better on gs San Jose CA Light rail,2025-01-24,4
Its not compatible with my phone. ALCATEL A10,2025-01-24,4
Not to Good,2025-01-14,4
"Pending charges rarely reflect pending charges. Half of the time they don't show us as pending at all, or they disappear for a couple of days as the charge changes from pending to posted.",2025-01-14,4
My phone is no longer compatible with the new version. It has been a HUGE inconvenience.,2025-01-13,4
When paying auto loan from checking app is not showing the transaction pending. Money deducts from checking next day but two says later payment does not show on loan. Why?,2025-01-10,4
"Attempts to download any of the WF apps results in : ""Your device is not compatible with this version"". 👎",2025-01-09,4
Doesn't accept monthly budget on app so far,2025-01-09,4
app clunky and difficult to navigate. I'm going to uninstall it immediately.,2025-01-07,4
a third party transfer system that kicks me out of the app just to log back in online? I'm trying to give someone money not run laps.,2025-01-06,4
my business shouldn't be public,2025-01-02,4
Previous update I was able to understand what was happening in my bank account and I could see my spending habits now it's say rushed condensed version of the website that I don't even use,2025-01-01,4
SLOW SLOW SLOW HATE THIS POS BANK,2024-12-31,4
"Here's that 'rest assured' that contradicts any security online on the phone with your 'rest assured' scenario.... 2nd MFA for obvious security i have options call text. I decided to use the call option. The automation is prompt with their call N a rest assured number they are calling from. ITS CERTAINLY NOT THE SAME NUMBER FROM AUTOMATION N CALLER ID. SO MY PHONES CALLS ARE WITHOUT A DOUBT BEING RE ROUTED, NOT3RDPARTY I can't express enough to you of my online intrusion from them ppl",2024-12-28,4
kept telling me the amount was wrong.,2024-12-24,4
should not be publicizing any information,2024-12-21,4
Difficult to open accounts in person and online. Excessive fees.,2024-12-20,4
took 10 tries,2024-12-18,4
"The app layout and features are pretty good, but More often than not I get an error message that says the system is unavailable.",2024-12-18,4
Keeps forgetting biometric sign in. Worst bank for rewards. They actively look for ways to NOT pay you,2024-12-17,4
Didn't answer my question,2024-12-17,4
So so not my cup of tea,2024-12-15,4
would only let me send a small amount. that is BS,2024-12-14,4
"Slow, and terrible customer service",2024-12-10,4
This app keeps closing when going to other apps. Very annoying,2024-12-08,4
not clear how to remedy errors,2024-12-08,4
Cant upgrade,2024-12-08,4
Wells Fargo seems to be having issues with notifications on the app alerts Not sure if the app is having notification issues. The app used to be very prompt.,2024-12-07,4
"Digital age and you can still get NSF? And have to wait to cash a check electronically? Developers will blame the user because of their apps limitations, the constraints their bank puts on them.",2024-12-05,4
"yes, u e heard that it was said if old that you reap sparingly you sow the same.",2024-12-05,4
"Was a good app and a sturdy one at that. But now it keeps saying I'm temporarily suspended due to to many incorrect password attempts... I'm putting in the correct password. When this windows pops up I have the choice of close or create new pw. So I create new pw then do the sign in and am hit with the temporarily suspended trap again. It's a vicious cycle as to where I just moved all of my cash $16k+ to Cash app and then into my Discover checking. Wells Fargo has a very low interest rate, also.",2024-12-05,4
Please bring back the text notifications!!!!! I like seeing my balance without having to log into the app.,2024-12-02,4
"Your last release (or 2) made the Android app really unreliable. I can usually login but after the home page, sometimes I can't see bill pay or transfer, sometimes account details isn't available. Fix the bugs, this sucks.",2024-11-30,4
I got twice an error message for nothing,2024-11-28,4
didn't show up in company truck. seemed fishy.,2024-11-24,4
Says amount didn't match even though it was very legible.,2024-11-23,4
"Wells Fargo is a great bank. I think the app needs more work. Transactions can't be seen until 3 or 4 days after. That can get confusing if you are always using your card and want to keep track of your purchases. I don't even see a pending until after days go by. I have multiple cards, and you can see all the purchases right away. So if that somehow can get fixed, that would be awesome.",2024-11-23,4
I have been a victim of identity theft All accounts pertaining to me Kedrian Hambrick are personal and not to be shared,2024-11-23,4
I love this app it's always looking out for my best interest.,2024-11-23,4
It that's to long to login to your account it keeps going on and off with your password and username.,2024-11-21,4
"Can't even write a review, yikes!",2024-11-20,4
Why do you not send a real card? I can never get to use this Fargo card that says I have a 2000dollar limit. This is so embarrassing to get either locked out of this card because log in or password has changed who does this to my passwords? I'm not very happy with this cards performance for my lifestyle fargo.. my paycheck is very high income. And I ts like I am always I a delema with Fargo. Let me spend like I want to I'm a big boy .don't want any Hassell from my money .so step aside and let,2024-11-19,4
Transactions take forever! Zelle always down,2024-11-19,4
my bank ATM would not let me withdraw money,2024-11-18,4
Fix the lag when first opening the app. it hangs from the time you select it to the time it gets to the login screen. no other app on my phone does that so must be a wf problem.,2024-11-16,4
Getting the app to accept the photos was backbreaking. So is Getting it to accept a review.,2024-11-15,4
Countless times have opened the app only to login and have to logout or reopen the app to actually access my account,2024-11-15,4
"Great app, poor bank",2024-11-13,4
was much better without 50 ai nags every time you open the app,2024-11-13,4
Because I have experience working with bank apps in other countries.,2024-11-12,4
Having log-on issues,2024-11-12,4
About the time I get my password filled in the screen resets. App focuses on what picture is in the background rather than operating efficiently. Just make a no frills app that works.,2024-11-12,4
