Review,Date,Stars
your AI is programmed by your corporation You are no different from other corporations The feeling of satisfaction is not the feeling of frustration that's what that AI does to people It's disgusting and it's not just you if that's helpful try not to make it so disgusting and annoying because it has a stubbornness that doesn't feel right to the customer It's obstinate in helping,2025-01-03,4
Just awesome...,2025-01-02,4
I think I've got the the right choice,2025-01-02,4
"depositing check are nice. id like the option to manually take the pictures though, or have a visual timer when the picture is about to be taken. would make it easier to get perfect angle and focus with less blur from movement.",2025-01-02,4
it's great,2025-01-02,4
"I couldn't see myself dealing with any other bank than Wells Fargo. the mayor of Los $3,000 in cedis back in 2010, but they made up in services & courtesy since 2019.",2025-01-01,4
"happy with Wells Fargo, employees are very helpful",2025-01-01,4
good banking app,2024-12-31,4
Ease of use! Easy layout,2024-12-31,4
great app!,2024-12-31,4
does what it needs to.,2024-12-30,4
Wells Fargo works hard to keep accounts safe and sound. Thank you.,2024-12-30,4
Very easy to use anywhere I am. Love it!,2024-12-28,4
Good,2024-12-28,4
Excellant,2024-12-28,4
Okay App but requires many updates. Now says my device isnt compatible with the new version.,2024-12-27,4
app works great,2024-12-27,4
Android has a terrible app that is constantly down and unavailable resulting in multiple login attempts. i do not recommend Wells Fargo on account of their app,2025-05-23,5
no real service,2025-05-23,5
Wells closed a 10yr account tied to our whole lives because of a typo on a hidden address unknown to us. Will take 3 months to get retirement checks going to new bank.,2025-05-22,5
terrible bank. never use this bank.,2025-05-22,5
took to long,2025-05-22,5
Horrific,2025-05-21,5
won't change ph# can't get text,2025-05-21,5
trash bank,2025-05-21,5
Tried to download the app again. Message says the Wells Fargo app is not compatible with my phone anymore. Why? It always has been until several months ago. Sure makes it harder to bank online. App needs maintenance!,2025-05-20,5
stupid app. the AI is dumber.,2025-05-20,5
"used 90000 points to get account credit. credit never applied. used app to get support, it is useless and just sends me to re-login to my rewards. requested to speak to an actual rep and it errors out and just says please try again later.",2025-05-20,5
fire your user interface guy. replacing color coded pending transactions with all dark emboldened characters on a mobile app is stupid.,2025-05-20,5
do not sell my information!,2025-05-20,5
directions are different every time,2025-05-20,5
"difficult to access account, no one answering calls on weekend. I have enough $$$$$$$ ,- I should be able 2 get access! So my tough luck I have wells not schwab brokerage!!!🙄",2025-05-18,5
2 hours trying to set it up,2025-05-18,5
"App developers willfully told anyone with an Android 9 that Wells doesn't want our business. When the app worked on 9 it was awesome. Now I have no online banking. Not spending 4 to 800 bucks on a new phone for ""new features"" I'm not interested in.",2025-05-16,5
"horrid company. Still uterly useless for doing anything than other than looking at your balances. 2020 update still 1 star. 2017 - Consistently terrible, for years. They still don't get the basics",2025-05-16,5
"I'm really disappointed that I wasn't able to Zelle or Transfer money without calling customer service. And then my account got restricted so I no longer have access. If Wells Fargo is an international bank, they must make sure that their customers( out of U.S.) can access their money, no matter where they are.",2025-05-16,5
"Depressing, and piss poor at customer back up. I'm disabled on fixed income & under id theft attacks off and on over 2 years. I am the victim of a crime not the perpetrator. Then why when i report something that only needs proactive action like new account number. You throw me out as a customer??? Grow a backbone or get out of banking, because the ones committing frauds, Don't need to get data from the vic. They can buy any data they want & get past all security's. Join the wimps at Chase.",2025-05-13,5
worst bank in history! After being approved for an active cash card and using it continuously with on time payments it was cancelled because supposedly I didn't give them my address information. I never received so much as a message to verify my information! p.s. the app is slow 👎,2025-05-13,5
it never sent a code...I have tried several times over the last few months with no success.,2025-05-13,5
won't let make a payment,2025-05-12,5
took 4 tries,2025-05-12,5
just wanted to get my rewards and this is a lot of work did not want an app for banking only rewards program.,2025-05-12,5
"This bank had me locked out my account for weeks as they investigated a fraud claim where I lost all of my savings by theft from a scam. As I was locked out they were charging daily interest. I closed all of my accounts paid the debt and still they sent me a bill on interest on a closed account. They keep you on hold forever, seemingly hoping you will give up, and I have small children it's really a waste of time. (they denied my claim) Run from them.",2025-05-12,5
terrible when trying to deposit check,2025-05-11,5
"Just a terrible outdated banking application. The capital one banking app and chase banking app actually function when you have multiple accounts this app limits you to one account per user i guess ( been told you can do multiple but no one knows how) Just has simple basic functions needs to be updated and brought into the year 2025 very, very badly, virtually useless",2025-05-11,5
account balance isn't accurate,2025-05-10,5
don't like doing reveiws,2025-05-09,5
"since wells Fargo updated their mobile app it will no longer work with a lot of older android phone's, so either go out and buy a new phone or find a better Bank? I believe I'll go look for a better Bank",2025-05-09,5
Mobile deposit takes 10+ tries for success. Worst mobile deposit app I've ever used.,2025-05-09,5
"Unable to remove Zelle recipient. ""Delete"" button is not functional.",2025-05-09,5
App can longer read front of checks with latest update. doesn't matter if it's a printed check or written check. It can't read the front since the latest update. Making mobile deposits impossible. Reads the back with endorsement just fine. Edit: Even with today's update. Doesn't read front of checks. That's two updates in a row where front of checks can't be captured with mobile deposit. Back of check still works. Useless for mobile deposit as it is. Pixel 9 Pro XL.,2025-05-09,5
"Disappointed by Treatment During Financial Hardship I’ve been a long-time customer of Wells Fargo, but I was deeply disappointed by how I was treated during a recent period of financial hardship. While my family and I were struggling for three months, the bank placed a week-long hold on my paycheck and closed my credit card account without warning. At a time when I needed support and flexibility the most, Wells Fargo failed to have my back. I expected more from an institution I’ve trusted.",2025-05-09,5
security is so high that even call center team isn't able to override to do basic functions like transfers,2025-05-08,5
Every time I sign in with Face ID the log in page goes to an error page saying THERE IS A PROBLEM ON OUR END. Fix your app please,2025-05-08,5
"No longer supported on my device. Very tempting to switch banks at this point, considering how expensive a phone will be every time my current one is obsoleted... And you can deposit thru a browser either.",2025-05-08,5
$10/mo for a checking account. ridiculous,2025-05-08,5
The worst bank I've ever encountered👎🏾,2025-05-08,5
honestly I don't like it because people on the system acting like they care what each other makes with their own money. and always playing like they are hackers and no one don't know but unfortunately I know much more than they think. I know people are manipulating my phone and spying on me everyday 24/7 and put me on YouTube. Facebook.. Instagram.. ticktock.. I don't what they really want it. that's why I don't trust any bank ir many other companies if not in person I don't trust the system,2025-05-08,5
"Constantly blocking my online wire transfers, so I have to go into the bank and wait an hour to pay more for a transfer. I need a new bank",2025-05-07,5
keeps crashing,2025-05-07,5
anytime I try to do something online and never works ever 😔,2025-05-07,5
I truly hate this bank. Can't wait to switch to a regional credit union.,2025-05-07,5
Says my device is no longer supported. A whole segment of Wells Fargo's customer base just lost their mobile banking.,2025-05-07,5
"Can not make a payment already for 5 days!!! There is wishes circle: upgrade app, verify it is you , app will be upgraded soon. Nothing happening . All from the beginning!!!",2025-05-06,5
Does not support Android 9.,2025-05-06,5
Don't do Bank to Bank transfer with Wells Fargo. Because they send you a response saying it will be in your account on a certain day. But they don't tell you until you call it has from 8am until 11:59 pm to be in the account. So it's better to take it out of the other bank account and put it in Wells Fargo account if you can. Or take it out of Wells Fargo account and put it into the other bank account if you can. Don't do Bank to Bank transfers.,2025-05-06,5
I can't even log in. The log in screen is so overlapped that it won't allow me to click the sign in button.,2025-05-06,5
"Wells Fargo is almost as bad as bank of america! Look up ""Fractal Banking"". 90% of any unpaid loan can be credited as a new loan, and then 90% of that loaned, and so on... It's fake/free money and they still have the audacity to charge banking fees for using your money to invest!? LMAO!",2025-05-06,5
i haven't gotten paid. i usually get paid at 3-4 pm on Tuesdays. it is currently 9p.m. do you know how bad this screwed me??????? been with this company almost a decade. im about to close my account. you are seriously messing with people's lives here...,2025-05-06,5
"if that stupid ai assistant doesn't go away, I'm changing banks.",2025-05-06,5
"The worst app that's out there. They banned me for a crypto purchase. Don't listen to them under my review talking about ""we're sorry to hear"". Nah, no your not. I've tried many times to get my account back and they always lead me to the same evil person that got me banned in the first place. Evil place. Loved the card itself. I still have it. Update: Wellsfargo owes me money!",2025-05-05,5
"worst bank, 8 days to deposit a check",2025-05-05,5
Been using it for a while then all of a sudden says app is no longer compatible with your phone anymore.,2025-05-04,5
they litreally stole money from me after they accidentally put $200k in my account. when i reported the mistake they locked my account for 4 months and reset it to zero dollers even though i had almost $5k before their mistake and told me id have to take them to court if i disagreed with their investigation. literally a criminal org.,2025-05-04,5
"Too many updates! Takes up alot of storage space, for minor changes!!!",2025-05-03,5
"placed a hold on my check. I dont go through banks that place holds, will be closing the account.",2025-05-03,5
I put in my correct social security number and my date of birth and it still won't let me create an account. Thanks for taking my information and not doing anything for me wells. zero stars if I could,2025-05-03,5
unable to use the app with my android that is ridiculous,2025-05-03,5
Latest update makes this app very difficult to use. 11 minutes to get code for two-step verification is inexcusable for a banking app.,2025-05-03,5
this app is terrible,2025-05-03,5
useless,2025-05-03,5
always hold my deposits to cause overdraft...,2025-05-01,5
don't sign up when they offer you a $200 promotion. they move heaven and earth not to give it to you. all you have to do is spend a certain amount in a certain amount of days which I did in half the time. they investigate it to see if you have earned it and never call you back. also you can only make a certain amount of payments each month online.,2025-05-01,5
trying to open up a checking account,2025-05-01,5
the new update is the worst one yet. everything is completely out of order it's harder to log in and it does not show what's pending and what's available to use anymore.,2025-04-30,5
"There is nothing special about this bank. To be honest, their fees are the same as every other bank, and customer support is equally as underwhelming. In my opinion, if you are thinking of swapping banks I would not go to Wells Fargo it will just be more of the same.",2025-04-30,5
you have my business WHY DO YOU SEND ME ADS I DONT LIKE IT !,2025-04-30,5
lowered my limit which directly lowered my credit score paid off cut up go Fargo yourself,2025-04-29,5
"The old app was awesome. I was forced to download the new app and it never loads. I've tried a number of times and get a message saying it will be added to my phone soon and nothing ever happens. So frustrating and really inconvenient. I can't do any mobile banking from my phone. Nothing was wrong with the old app. Have you ever heard the saying, ""If it's not broken, don't fix it.""?",2025-04-29,5
"l keep receiveing a message that my operating system does not support the update. Well, I am not buying a new phone😁",2025-04-29,5
to much red tape,2025-04-29,5
don't like the new update. revert it back.,2025-04-29,5
"I started with this bank as a kids account and at this point I only use it to pay bills. But I am moving away from that. Charging me $10 a month for not using this account is a little silly and outdated I feel that way for any bank but what do you expect from a bank that has so many scandals. Thankfully I can Navy federal credit union, not everyone has different options but wells fargo probably isn't the best",2025-04-29,5
"app not combatible with my phone, I need to buy a new phone? Time to switch to another bank.",2025-04-29,5
"It's absurd not to allow me to set up my spouses account for transfer, even if she has an account at a different institution. I don't want to use Zelle, I want to transfer from account to account",2025-04-28,5
the app won't allow me to delete recipients. on Zelle. please fix bug.,2025-04-28,5
cant use the app with my phone and I work during bank hours so cant deposit my check with a teller. Do not currently have my debit card so cant deposit my check at the drive thru. At best its extremely inconvenient and is generally useless.,2025-04-27,5
I have talked with customer support about the purchase I made on Ali Express and it keeps denying the transaction because Wells Fargo thinks my card is hijacked and has to keep confirming its me and I keep saying yes its me and the transaction keeps failing. I cant even buy what I need Wells Fargo is locking my card when I have been nothing but confirming its me using it.,2025-04-27,5
No useful help at all.,2025-04-27,5
Just do what I ask. Nothing more than that.,2025-04-26,5
"The changing of your app is not the fault of our phones. it is because Wells Fargo doesn't care about its long lasting customers. Your app excluded many older phones. Unfortunately due to not being able to deposit checks through my phone app. as well as I will now have to be going to a branch, I will be forced to leave Wells Fargo after more than 45 years.",2025-04-26,5
Biometrics interface is aweful,2025-04-25,5
too hard to use,2025-04-25,5
"Use to be great, doesn't work at all anymore. Tried to delete and reinstall after the update failed, won't even install.",2025-04-25,5
"my experience was horrible. I wanted the online Wells Fargo app. I called the bank and asked for help they would not open my account because I couldn't answer some questions about my account because someone had already hacked into my account, and that's why I needed the online app .",2025-04-25,5
false pretense as usual...,2025-04-25,5
"they charge you more money when you run out, eff offf",2025-04-25,5
adds,2025-04-24,5
It could be a LOT BETTER.,2025-04-24,5
So badly !! No access to my account. I'm out of usa without money,2025-04-24,5
if I cannot use my phone to check my bank account. then I will be taking all my money out of wells fargo.,2025-04-24,5
Terrible i can not access my bank account,2025-04-24,5
terrible monthly checking account fees!! Stay away!!!,2025-04-24,5
I would need to buy a new phone to use the app.,2025-04-24,5
won't work to sign up,2025-04-23,5
"When I want to use the mobile app already installed I am advised it requires an update. When I am sent to the app, it will not update.",2025-04-23,5
this bank sucks,2025-04-22,5
"I would rather keep my money in a mattress than deal with these crooks. worst company, worst customer service.",2025-04-21,5
Nice there's no option for night mode,2025-04-21,5
quit freaking advertising on the damn app,2025-04-21,5
"Used to be a great app. Now is ""securely logs"" you out while doing anything.",2025-04-20,5
"the app no longer appears to be able to open the camera for mobile deposits. if this is not fixed, I have no reason to stay with Wells Fargo for my business.",2025-04-19,5
Completely useless app!!! Don't waste your time with it!,2025-04-19,5
So freaking sick of this app. It invalidates the password ALL THE TIME. The password that I KNOW is right and makes me change it. And of course the password rules are idiotic in not letting me reuse the pw (that I know works). I hate this bank. I hate this app. I have 4 other bank apps that do NOT do this. But then again they don't charge me fees like WF either. Can not wait to switch my buisness away from these vultures.,2025-04-19,5
No reason to download the app for most people. Only reason you would need it is to deposit checks by phone. App makes me MFA every single log in and is slow. It doesn't do anything for me the mobile website doesn't do.,2025-04-19,5
Zelle isn't working??,2025-04-18,5
No longer compatible with my device. This is a huge disappointment as the phone is not that old and was a flagship model. I do not want to have to purchase a new one just so I can use my banking app when this one works perfectly fine. Looks like I'm going to go with my local CU as their app IS still compatible. I've been a loyal customer for most of my adult life. Your dev's should really consider ALL of your customer base. It is not that hard to include older operating systems. Do better!,2025-04-18,5
"because of a $48 charge from AMC just 6 years ago, they are closing my Checking Account on May 1st. I just got a new Debit Card & activated it, and they blocked it.",2025-04-17,5
Wells Fargo is a fraudulent company in 2016 they bank opened millions of bank and credit accounts in customers names without their permissions all to increase sales targets and incentive quotas. I will never do business with them again.,2025-04-17,5
"They should rename the bank ""scammers r us"". I banked with you since 2009. At the first opportunity you tried to scam me. Shame on you!!! I will take my business elsewhere!!!",2025-04-17,5
sorry,2025-04-17,5
I really dislike this stupid app,2025-04-16,5
rubbish,2025-04-16,5
Bill payment takes far too long to change checking account balance. I used bill pay to pay a Chase credit card from the Wells Fargo app. Chase acknowledged the payment and changed the credit card balance before my Wells Fargo checking account acknowledged the payment!,2025-04-16,5
ur mobile app doesnt make it easy to manage investements im not getting all my money dude i was gonna be a billionare,2025-04-16,5
app isn't compatible with my device anymore,2025-04-16,5
needs more improvements,2025-04-15,5
"I was going to let this be a terrible app full of pop-ups and not say anything, but they popped up a rating request.",2025-04-15,5
"sucks, have been trying to sign in for 2 days and keeps telling I'm shut off",2025-04-15,5
cannot use app with the phone I have. I was able to deposit checks using my phone and the online version up until early March without using the app. What good is having an app that not everyone can use? I've been with Wells Fargo for over 20 yrs but maybe it's time for a new bank!!,2025-04-13,5
I have a Galaxy S9 and it says my phone isnt compatible and I can't make a deposit.,2025-04-12,5
"Had to buy a new phone to use the app, also the app has to many ridiculous, additions for a bank to have. ""Fargo"" fortune telling trash.",2025-04-12,5
"No mention of small business fees anywhere when signing up. Scared to use them after the account is opened. No disclosures. Fine, I won't give them my money",2025-04-11,5
Can't email them and setting up payments is a waste of time,2025-04-11,5
Wells Fargo is not up to PAR,2025-04-11,5
redesign your qr code sharing,2025-04-10,5
they are quick to close and block your account without warning. do not use.,2025-04-10,5
"""overdraft protection"" is a scam. if i dont have the money dont pay it for me. ive done all that i can to make it so you wont do this but still i get 35.00 charges on a charge that i have to pay also this is a strait scam",2025-04-10,5
I have a new Motorola phone it does not allow me to use your app you took the old app away from me now I can't do my banking in this day and age it is reprehensible that you have taken the security away from me. I think I should organize on social media and get a class action suit against Wells Fargo enough double talk fix the app fire your tech people hire better ones,2025-04-09,5
"app is always saying unavailable, check back later",2025-04-09,5
junk dosent work,2025-04-08,5
doesn't work anymore,2025-04-08,5
Dropped support for my phome,2025-04-08,5
30 years l have been with wells fargo. They can do better with older generantion hans on bankers online people. The app is not working please tell me why.l need to manage my accou nt,2025-04-08,5
it won't let install the app on my new phone..my other phone got a virus.,2025-04-07,5
the app will not update,2025-04-07,5
do not understand,2025-04-05,5
deposits no longer work and your previous response was weeks ago. so nothing done,2025-04-05,5
Hard to deposit checks after 5 attempts! Loser bank. How is it legal to offer a 0.01% interest rate on savings?,2025-04-05,5
"i get error message ""this app won't work for your device "". it used to work. what changed on my Samsung note 8 phone?",2025-04-05,5
where is my check?..is this app under maintenance right now?..I was suppose to have it every Friday at 4:15 pm..and I didn't get this one...where is it wells fargo🤔,2025-04-05,5
"In a world filled with predatory banks, Wells Fargo is a downright criminal enterprise. Just Google some of the legal settlements they have agreed to based on their abhorrent behavior. I paid a new employee by direct deposit, and the employee accidentally provided an incorrect checking and routing number. Wells Fargo refused to return the funds that were deposited into someone else's account erroneously.",2025-04-04,5
app doesn't support my version of android OS,2025-04-04,5
fix it,2025-04-04,5
WTH ..Suddenly we can't take screenshots of our deposits & balance?,2025-04-04,5
will not update.,2025-04-03,5
"Disappointed by inability to deposit checks on Samsung S20. yes the phone is a couple years old, but it's not THAT old.",2025-04-03,5
Check alert(s) On- manage alerts- was taken away. Needs to be put back. I called your 1-800 number and your representative couldn't fix it. I your ceo needs to earn his paycheck and fix this. And FYI: I had checks alerts setup for years on your app before you took it away.,2025-04-03,5
This application has alway's been safe until there hacker's. Then; it happen's ALL time!,2025-04-03,5
The app lacks functionality for Wells Fargo Trading functions,2025-04-02,5
worked until update and no longer supports app on my phone. thanks!,2025-04-02,5
one of worse bank....the stolen my money...add fee $185 in one month for $400....don't trust them...,2025-04-02,5
thieves,2025-04-02,5
"The app is fine, Wells Fargo is the problem. They are predatory and unwilling to work with you even if you try to call and get ahead of the situation. They also will not stop overdrafts, even if you are already in a negative balance. What's worse is then they charge you an obscene overdraft fee often bigger than the original payment.",2025-04-02,5
"Another forced app update for supposed ""features"" which are nothing more than an invasion of your privacy. WF sucks but you need a bank account.",2025-04-02,5
bad!!,2025-04-01,5
"a very dishonest banking institution. because there was some fraud done from outside on my account, my credit card account was closed without notifying me or giving me the chance to have an inquiry about it. It's a very dishonest institution. I also never received my $325 motion for opening up a checking account last year.",2025-04-01,5
i am unable to update wells Fargo app,2025-04-01,5
I dont want to see adds of any kind.,2025-04-01,5
The new update contains ads. I'm closing my account. WF is a loan shark.,2025-03-31,5
the app is no longer compatible with my Samsung SM-J737T. I wonder how many others are impacted by this problem???,2025-03-31,5
Balance on the app/account should be more clear/transparent it is very inconvinient and frustrating not seeing the transaction details and balance right when you sign in and clic on transactions. Please don't reply asking to contact you unless I'm getting paid,2025-03-31,5
"I am not finding any perks to a wells fargo account. In addition out of all the banks I have affiliated with wells Fargo is the only bank that has screwed me with out reason, and for that I suggest any bank even a mom and pop bank over them.",2025-03-29,5
